call_id,utterance_number,speaker,text,has_profanity,profane_words
742147aa-a2df-4429-859e-05b4a7875563,10,customer,"Yes, that's right.",False,
742147aa-a2df-4429-859e-05b4a7875563,11,agent,Great! Let's go ahead and process that. How would you like to make the payment?,False,
742147aa-a2df-4429-859e-05b4a7875563,12,customer,I can do it over the phone with my credit card.,False,
742147aa-a2df-4429-859e-05b4a7875563,13,agent,Perfect. I just need the card number to get started.,False,
742147aa-a2df-4429-859e-05b4a7875563,14,customer,It's 5555 4444 3333 2222.,False,
742147aa-a2df-4429-859e-05b4a7875563,15,agent,"Thank you for providing that. Now, your payment will be processed shortly. Is there anything else I can assist you with today?",False,
41fac7e4-d242-4887-9f54-f891dff6ff70,1,agent,"Hello, this is James from XYZ Collections. Am I speaking with Michael?",False,
41fac7e4-d242-4887-9f54-f891dff6ff70,2,customer,"Yes, this is Michael. What's this about?",False,
41fac7e4-d242-4887-9f54-f891dff6ff70,3,agent,"I'm calling regarding a past due account. Before I provide any details, could you please verify your date of birth for security purposes?",False,
41fac7e4-d242-4887-9f54-f891dff6ff70,4,customer,"Sure, it's January 15, 1990.",False,
41fac7e4-d242-4887-9f54-f891dff6ff70,5,agent,"Thank you, Michael. Can you also confirm your current address?",False,
41fac7e4-d242-4887-9f54-f891dff6ff70,6,customer,"I live at 123 Elm Street, Springfield.",False,
41fac7e4-d242-4887-9f54-f891dff6ff70,7,agent,Thank you for that information. You have an outstanding balance of $350. How would you like to proceed with the payment?,False,
41fac7e4-d242-4887-9f54-f891dff6ff70,8,customer,I can pay $150 right now and the rest later.,False,
41fac7e4-d242-4887-9f54-f891dff6ff70,9,agent,That works. I can set up a partial payment for today. How will you be making the payment?,False,
41fac7e4-d242-4887-9f54-f891dff6ff70,10,customer,I’ll pay with my credit card.,False,
41fac7e4-d242-4887-9f54-f891dff6ff70,11,agent,"Great! Please provide your card details, and I will process that for you.",False,
41fac7e4-d242-4887-9f54-f891dff6ff70,12,customer,"Sure, the number is 1234-5678-9012-3456.",False,
41fac7e4-d242-4887-9f54-f891dff6ff70,13,agent,"Thank you, Michael. Your payment is being processed, and you will receive a confirmation shortly.",False,
41fac7e4-d242-4887-9f54-f891dff6ff70,14,customer,Thanks for your help!,False,
41fac7e4-d242-4887-9f54-f891dff6ff70,15,agent,You're welcome. Have a great day!,False,
49dca3af-dcec-423e-939d-93811e8a51a9,1,agent,"Hello, this is Mark from XYZ Collections. Am I speaking with Sarah Thompson?",False,
49dca3af-dcec-423e-939d-93811e8a51a9,2,customer,"Yes, this is Sarah. What is this about?",False,
49dca3af-dcec-423e-939d-93811e8a51a9,3,agent,"Thank you, Sarah. I'm calling regarding the outstanding balance on your account. Before we proceed, could you please confirm your date of birth?",False,
49dca3af-dcec-423e-939d-93811e8a51a9,4,customer,"Sure, it's January 15, 1992.",False,
49dca3af-dcec-423e-939d-93811e8a51a9,5,agent,"Thank you for verifying that. Now, can you also confirm your address for me?",False,
49dca3af-dcec-423e-939d-93811e8a51a9,6,customer,"Yes, it’s 123 Maple Street, Springfield.",False,
49dca3af-dcec-423e-939d-93811e8a51a9,7,agent,"Thank you, Sarah. I see here that you have an outstanding balance of $350. How would you like to proceed with the payment?",False,
49dca3af-dcec-423e-939d-93811e8a51a9,8,customer,I would like to set up a payment plan.,False,
49dca3af-dcec-423e-939d-93811e8a51a9,9,agent,That’s completely fine. I can assist you with that. What amount can you pay monthly?,False,
49dca3af-dcec-423e-939d-93811e8a51a9,10,customer,I can manage $100 a month.,False,
49dca3af-dcec-423e-939d-93811e8a51a9,11,agent,Great! I’ll set that up for you starting next month. You will receive confirmation via email.,False,
49dca3af-dcec-423e-939d-93811e8a51a9,12,customer,Thank you for your help.,False,
49dca3af-dcec-423e-939d-93811e8a51a9,13,agent,"You're welcome, Sarah! If you have any questions, feel free to reach out. Have a great day!",False,
49dca3af-dcec-423e-939d-93811e8a51a9,14,customer,"You too, bye!",False,
ee078707-82d8-4937-942a-0d1dce58dac5,1,agent,"Hello, this is Mark calling from XYZ Collections. How are you today?",False,
ee078707-82d8-4937-942a-0d1dce58dac5,2,customer,"I'm doing alright, thanks. What’s this about?",False,
ee078707-82d8-4937-942a-0d1dce58dac5,3,agent,I'm calling regarding an outstanding balance on your account with Mega Credit. Can I get you to confirm your name for security purposes?,False,
ee078707-82d8-4937-942a-0d1dce58dac5,4,customer,"Sure, it's Jessica Brown.",False,
ee078707-82d8-4937-942a-0d1dce58dac5,5,agent,"Thank you, Jessica. You currently have a balance of two thousand five hundred dollars.",False,
ee078707-82d8-4937-942a-0d1dce58dac5,6,customer,That's quite a bit. Can you give me more details on that?,False,
ee078707-82d8-4937-942a-0d1dce58dac5,7,agent,Of course! This amount includes your last payment and the missed payments since then.,False,
ee078707-82d8-4937-942a-0d1dce58dac5,8,customer,I see. I wasn't aware of the total. What options do I have?,False,
ee078707-82d8-4937-942a-0d1dce58dac5,9,agent,You can make a payment plan or pay the full amount today. What works best for you?,False,
ee078707-82d8-4937-942a-0d1dce58dac5,10,customer,I need some time to think about that.,False,
ee078707-82d8-4937-942a-0d1dce58dac5,11,agent,"No problem! Please feel free to reach out if you have any questions, but just remember the balance is accumulating interest.",False,
ee078707-82d8-4937-942a-0d1dce58dac5,12,customer,"Got it, thank you.",False,
ee078707-82d8-4937-942a-0d1dce58dac5,13,agent,"Thank you for your time, Jessica. Have a great day!",False,
ee078707-82d8-4937-942a-0d1dce58dac5,14,customer,"You too, bye!",False,
b6eb2096-6102-431d-b0df-4a87310d46c4,1,agent,"Hello, is this Mr. Thompson? This is Lisa calling from XYZ Collections. How are you today?",False,
b6eb2096-6102-431d-b0df-4a87310d46c4,2,customer,"Yes, this is Mr. Thompson. I'm doing fine, thank you.",False,
b6eb2096-6102-431d-b0df-4a87310d46c4,3,agent,I'm glad to hear that! I'm reaching out regarding your outstanding balance with City Credit. Can you confirm your last payment date?,False,
b6eb2096-6102-431d-b0df-4a87310d46c4,4,customer,I believe it was in June of last year.,False,
b6eb2096-6102-431d-b0df-4a87310d46c4,5,agent,Thank you for that. I see here you have an outstanding balance of $450. Would you like to settle that today?,False,
b6eb2096-6102-431d-b0df-4a87310d46c4,6,customer,I was hoping to set up a payment plan instead.,False,
b6eb2096-6102-431d-b0df-4a87310d46c4,7,agent,"Absolutely, we can work something out. I can set up a payment plan of $100 per month for four months.",False,
b6eb2096-6102-431d-b0df-4a87310d46c4,8,customer,That sounds reasonable to me.,False,
b6eb2096-6102-431d-b0df-4a87310d46c4,9,agent,Great! Can I confirm the payment method you would like to use?,False,
b6eb2096-6102-431d-b0df-4a87310d46c4,10,customer,I'll use my debit card.,False,
b6eb2096-6102-431d-b0df-4a87310d46c4,11,agent,Perfect. Your first payment will be processed today. Thank you for your cooperation!,False,
b6eb2096-6102-431d-b0df-4a87310d46c4,12,customer,Thank you for understanding. Have a great day!,False,
b6eb2096-6102-431d-b0df-4a87310d46c4,13,agent,"You too, Mr. Thompson! Don't hesitate to reach out if you have any questions.",False,
b76917d8-cb80-481a-84d5-25de34e98f95,1,agent,"Good afternoon, this is Robert calling from XYZ Collections. How are you today?",False,
b76917d8-cb80-481a-84d5-25de34e98f95,2,customer,"I'm fine, thank you. What is this about?",False,
b76917d8-cb80-481a-84d5-25de34e98f95,3,agent,"I'm here to discuss your account with City Credit. Before we proceed, could you please verify your date of birth?",False,
b76917d8-cb80-481a-84d5-25de34e98f95,4,customer,"It's July 15, 1990.",False,
b76917d8-cb80-481a-84d5-25de34e98f95,5,agent,Thank you for confirming your date of birth. Can you also provide the last four digits of your Social Security number for verification?,False,
b76917d8-cb80-481a-84d5-25de34e98f95,6,customer,"Sure, it's 1234.",False,
b76917d8-cb80-481a-84d5-25de34e98f95,7,agent,Thank you for that. I confirm your identity. You currently have a balance of $250 on your account. How would you like to proceed with payment?,False,
b76917d8-cb80-481a-84d5-25de34e98f95,8,customer,I’d like to set up a payment plan.,False,
b76917d8-cb80-481a-84d5-25de34e98f95,9,agent,Absolutely! We can set that up. Would you prefer weekly or monthly payments?,False,
b76917d8-cb80-481a-84d5-25de34e98f95,10,customer,Monthly payments would work for me.,False,
b76917d8-cb80-481a-84d5-25de34e98f95,11,agent,Great! I’ll set you up for monthly payments of $62.50. Does that sound good?,False,
b76917d8-cb80-481a-84d5-25de34e98f95,12,customer,"Yes, that works.",False,
b76917d8-cb80-481a-84d5-25de34e98f95,13,agent,Thank you for confirming. You’ll receive a confirmation email shortly. Have a great day!,False,
b76917d8-cb80-481a-84d5-25de34e98f95,14,customer,"Thanks, you too!",False,
f53b56bf-c27d-4900-8ed6-9c66a4691268,1,agent,"Hello, this is Mark calling from XYZ Collections. How are you today?",False,
f53b56bf-c27d-4900-8ed6-9c66a4691268,2,customer,"I’m fine, thank you. What’s this about?",False,
f53b56bf-c27d-4900-8ed6-9c66a4691268,3,agent,"I’m calling regarding an outstanding balance on your account. Before we proceed, can you please verify your date of birth?",False,
f53b56bf-c27d-4900-8ed6-9c66a4691268,4,customer,"Sure, it’s July 15, 1990.",False,
f53b56bf-c27d-4900-8ed6-9c66a4691268,5,agent,Thank you for that. Can you also confirm your current address for security purposes?,False,
f53b56bf-c27d-4900-8ed6-9c66a4691268,6,customer,"Yes, it’s 123 Main Street, Springfield.",False,
f53b56bf-c27d-4900-8ed6-9c66a4691268,7,agent,Thank you for confirming your identity. You currently have a balance of $250 on your account.,False,
f53b56bf-c27d-4900-8ed6-9c66a4691268,8,customer,I thought I paid that last month.,False,
f53b56bf-c27d-4900-8ed6-9c66a4691268,9,agent,I understand your concern. Let me check the payment history for you.,False,
f53b56bf-c27d-4900-8ed6-9c66a4691268,10,customer,"Okay, I appreciate that.",False,
f53b56bf-c27d-4900-8ed6-9c66a4691268,11,agent,It appears the payment was missed. How would you like to settle this today?,False,
f53b56bf-c27d-4900-8ed6-9c66a4691268,12,customer,I can pay half of it now and the rest next week.,False,
f53b56bf-c27d-4900-8ed6-9c66a4691268,13,agent,That sounds reasonable. Let’s process that payment of $125 right away.,False,
f53b56bf-c27d-4900-8ed6-9c66a4691268,14,customer,"Great, thank you for your help!",False,
f53b56bf-c27d-4900-8ed6-9c66a4691268,15,agent,You’re welcome! Thanks for your cooperation today.,False,
5c0bf9ad-669f-4a26-8c08-4af6f9698cf0,1,agent,"Hello, this is Mark from XYZ Collections. How are you today?",False,
5c0bf9ad-669f-4a26-8c08-4af6f9698cf0,2,customer,"I'm doing alright, thanks. What is this about?",False,
5c0bf9ad-669f-4a26-8c08-4af6f9698cf0,3,agent,I'm calling in regard to your account with Quick Loans. Can you please confirm your full name so we can proceed?,False,
5c0bf9ad-669f-4a26-8c08-4af6f9698cf0,4,customer,It's John Smith.,False,
5c0bf9ad-669f-4a26-8c08-4af6f9698cf0,5,agent,"Thank you, John. I see that your current balance is $450. Would you like to discuss payment options?",False,
5c0bf9ad-669f-4a26-8c08-4af6f9698cf0,6,customer,"Yes, I need to figure out what I can afford this month.",False,
5c0bf9ad-669f-4a26-8c08-4af6f9698cf0,7,agent,Absolutely. We can set up a payment plan. How much can you commit to each month?,False,
5c0bf9ad-669f-4a26-8c08-4af6f9698cf0,8,customer,I could do $100 a month for now.,False,
5c0bf9ad-669f-4a26-8c08-4af6f9698cf0,9,agent,"That works, John. I’ll go ahead and set that up. Just to confirm, the first payment will be due next week on the 8th.",False,
5c0bf9ad-669f-4a26-8c08-4af6f9698cf0,10,customer,Sounds good to me. Thank you for your help.,False,
5c0bf9ad-669f-4a26-8c08-4af6f9698cf0,11,agent,You're welcome. Is there anything else you would like to ask?,False,
5c0bf9ad-669f-4a26-8c08-4af6f9698cf0,12,customer,"No, that's everything for now.",False,
5c0bf9ad-669f-4a26-8c08-4af6f9698cf0,13,agent,"Alright, thank you for your time, John. Have a great day!",False,
5c0bf9ad-669f-4a26-8c08-4af6f9698cf0,14,customer,You too! Bye.,False,
b93535c4-ce25-4fd6-a203-4e726566469b,1,agent,"Hello, is this Alex Johnson?",False,
b93535c4-ce25-4fd6-a203-4e726566469b,2,customer,"Yes, this is Alex. Who's calling?",False,
b93535c4-ce25-4fd6-a203-4e726566469b,3,agent,"Hi Alex, I'm Laura from XYZ Collections. I'm calling regarding your account. Can I please verify your date of birth?",False,
b93535c4-ce25-4fd6-a203-4e726566469b,4,customer,"Sure, it's April 15, 1990.",False,
b93535c4-ce25-4fd6-a203-4e726566469b,5,agent,"Thank you, Alex. Now, can you please confirm your address for me?",False,
b93535c4-ce25-4fd6-a203-4e726566469b,6,customer,"It's 123 Maple Street, Springfield.",False,
b93535c4-ce25-4fd6-a203-4e726566469b,7,agent,Thank you for that information. You currently have an outstanding balance of $250 on your account. Would you like to discuss payment options?,False,
b93535c4-ce25-4fd6-a203-4e726566469b,8,customer,"Yes, I would like to know how I can pay it off.",False,
b93535c4-ce25-4fd6-a203-4e726566469b,9,agent,You can pay online via our website or set up a payment plan if that works better for you.,False,
b93535c4-ce25-4fd6-a203-4e726566469b,10,customer,I think I'll pay online today.,False,
b93535c4-ce25-4fd6-a203-4e726566469b,11,agent,Great choice! I will send you an email with the payment link shortly.,False,
b93535c4-ce25-4fd6-a203-4e726566469b,12,customer,Thank you for your help!,False,
b93535c4-ce25-4fd6-a203-4e726566469b,13,agent,"You're welcome, Alex. Have a great day!",False,
52ddb4a0-0599-4e18-a961-ac4b67da8d5e,1,agent,"Hello, is this Mark Thompson?",False,
52ddb4a0-0599-4e18-a961-ac4b67da8d5e,2,customer,"Yes, this is Mark. How can I help you?",False,
52ddb4a0-0599-4e18-a961-ac4b67da8d5e,3,agent,"I'm calling from XYZ Collections about your outstanding balance. First, can you verify your date of birth?",False,
52ddb4a0-0599-4e18-a961-ac4b67da8d5e,4,customer,"Sure, it's May 12, 1985.",False,
52ddb4a0-0599-4e18-a961-ac4b67da8d5e,5,agent,"Alright, and can you confirm your current address?",False,
52ddb4a0-0599-4e18-a961-ac4b67da8d5e,6,customer,"Yes, it's 1234 Elm Street, Springfield.",False,
52ddb4a0-0599-4e18-a961-ac4b67da8d5e,7,agent,"Great, thanks. You have a balance of $750. What the hell are you going to do about it?",True,hell
52ddb4a0-0599-4e18-a961-ac4b67da8d5e,8,customer,I would like to discuss payment options.,False,
52ddb4a0-0599-4e18-a961-ac4b67da8d5e,9,agent,"Payment options? Just pay it already, it’s not that hard!",False,
52ddb4a0-0599-4e18-a961-ac4b67da8d5e,10,customer,"I understand, but I need a few moments to arrange that.",False,
52ddb4a0-0599-4e18-a961-ac4b67da8d5e,11,agent,"Hurry the hell up then! This is a joke, right?",True,hell
52ddb4a0-0599-4e18-a961-ac4b67da8d5e,12,customer,I assure you this is not a joke. I will make this payment soon.,False,
52ddb4a0-0599-4e18-a961-ac4b67da8d5e,13,agent,"Whatever, just don’t take too long or I’ll come after you!",False,
52ddb4a0-0599-4e18-a961-ac4b67da8d5e,14,customer,"Thank you for your time, I will handle this shortly.",False,
52ddb4a0-0599-4e18-a961-ac4b67da8d5e,15,agent,"Yeah, sure. Good luck with that!",False,
50abe040-847c-47e1-962f-a00d7ff2cfe4,1,agent,"Hello, this is Jake from XYZ Collections. Is this John?",False,
50abe040-847c-47e1-962f-a00d7ff2cfe4,2,customer,"Yes, this is John. How can I help you?",False,
50abe040-847c-47e1-962f-a00d7ff2cfe4,3,agent,"I'm calling about your overdue account. You’re really behind on your payments, you know that?",False,
50abe040-847c-47e1-962f-a00d7ff2cfe4,4,customer,I am aware of that and I’m trying to work on it. Can you provide me with more details?,False,
50abe040-847c-47e1-962f-a00d7ff2cfe4,5,agent,Details? You should already know that you owe us—get your act together!,False,
50abe040-847c-47e1-962f-a00d7ff2cfe4,6,customer,"I understand, but I don't have that information on hand. Can you please confirm the balance?",False,
50abe040-847c-47e1-962f-a00d7ff2cfe4,7,agent,"You don’t even know how much you owe? Pathetic. It’s $500, and you need to pay it now.",False,
50abe040-847c-47e1-962f-a00d7ff2cfe4,8,customer,"I really want to settle this, but I need to review my options first.",False,
50abe040-847c-47e1-962f-a00d7ff2cfe4,9,agent,Options? Like what? You can borrow money from your mommy? Just pay up!,False,
50abe040-847c-47e1-962f-a00d7ff2cfe4,10,customer,I am not looking for insults. I want to resolve this matter professionally.,False,
50abe040-847c-47e1-962f-a00d7ff2cfe4,11,agent,"Professionally? This is a debt collection call, not a tea party! Pay your damn bills!",True,damn
50abe040-847c-47e1-962f-a00d7ff2cfe4,12,customer,I get that. I just need a couple of days to sort things out.,False,
50abe040-847c-47e1-962f-a00d7ff2cfe4,13,agent,A couple of days? You better not be wasting my time! What’s your next excuse?,False,
50abe040-847c-47e1-962f-a00d7ff2cfe4,14,customer,I'm not making excuses. I am trying to work with you. Please give me some space.,False,
50abe040-847c-47e1-962f-a00d7ff2cfe4,15,agent,Fine! But you’re only digging yourself deeper with this crap. Bye!,True,crap
2fbb34f8-fa48-4736-bc04-34e12819d43a,1,agent,"Hello, this is Mark from XYZ Collections. How are you today?",False,
2fbb34f8-fa48-4736-bc04-34e12819d43a,2,customer,"I'm okay, thanks. What is this about?",False,
2fbb34f8-fa48-4736-bc04-34e12819d43a,3,agent,I'm calling regarding an outstanding balance on your account. Can you please confirm your date of birth for verification?,False,
2fbb34f8-fa48-4736-bc04-34e12819d43a,4,customer,"Sure, it's July 15th, 1985.",False,
2fbb34f8-fa48-4736-bc04-34e12819d43a,5,agent,Thank you for that. Can you also confirm your current address?,False,
2fbb34f8-fa48-4736-bc04-34e12819d43a,6,customer,"Yes, it's 123 Elm Street, Springfield.",False,
2fbb34f8-fa48-4736-bc04-34e12819d43a,7,agent,Thank you for verifying your information. You currently owe $250 on your account. How would you like to proceed with payment?,False,
2fbb34f8-fa48-4736-bc04-34e12819d43a,8,customer,I can pay that with a credit card right now.,False,
2fbb34f8-fa48-4736-bc04-34e12819d43a,9,agent,Great! I can assist you with that. Please provide your card details.,False,
2fbb34f8-fa48-4736-bc04-34e12819d43a,10,customer,My card number is 4567 8912 3456 7890.,False,
2fbb34f8-fa48-4736-bc04-34e12819d43a,11,agent,Thank you. Can you also give me the expiration date and CVV code?,False,
2fbb34f8-fa48-4736-bc04-34e12819d43a,12,customer,The expiration date is 12/25 and the CVV is 123.,False,
2fbb34f8-fa48-4736-bc04-34e12819d43a,13,agent,Thank you for providing that information. Your payment is being processed now.,False,
2fbb34f8-fa48-4736-bc04-34e12819d43a,14,customer,Great! Thanks for your help.,False,
2fbb34f8-fa48-4736-bc04-34e12819d43a,15,agent,"You're welcome! If you have any further questions, feel free to reach out. Have a great day!",False,
34afbce9-7315-4a25-826b-5d70446a5dd8,1,agent,"Hello, this is Mark from XYZ Collections. How are you today?",False,
34afbce9-7315-4a25-826b-5d70446a5dd8,2,customer,"I'm fine, but I don't appreciate these calls. What do you want?",False,
34afbce9-7315-4a25-826b-5d70446a5dd8,3,agent,I understand your frustration. I'm calling about your overdue account with ABC Services.,False,
34afbce9-7315-4a25-826b-5d70446a5dd8,4,customer,I've told you before to stop calling me. I want my number on the do not call list!,False,
34afbce9-7315-4a25-826b-5d70446a5dd8,5,agent,I'm really sorry for the inconvenience. Let me assist you with that right away.,False,
34afbce9-7315-4a25-826b-5d70446a5dd8,6,customer,Please make sure it's done. I don't want to hear from you again.,False,
34afbce9-7315-4a25-826b-5d70446a5dd8,7,agent,"I assure you, I will mark your number as do not call immediately.",False,
34afbce9-7315-4a25-826b-5d70446a5dd8,8,customer,Thank you. I hope this time it works.,False,
34afbce9-7315-4a25-826b-5d70446a5dd8,9,agent,You're welcome. Your number is now on the do not call list.,False,
6941b4ed-b5d9-451b-8ffc-ee80b4904702,1,agent,"Hello, this is Sarah calling from Debt Solutions. How are you today?",False,
6941b4ed-b5d9-451b-8ffc-ee80b4904702,2,customer,"Hi Sarah, I'm alright, thanks. What's this about?",False,
6941b4ed-b5d9-451b-8ffc-ee80b4904702,3,agent,"I’m reaching out regarding an outstanding balance on your account. Before we proceed, could you please confirm your date of birth?",False,
6941b4ed-b5d9-451b-8ffc-ee80b4904702,4,customer,"Sure, it's July 15, 1990.",False,
6941b4ed-b5d9-451b-8ffc-ee80b4904702,5,agent,Thank you for that information. Can you also verify your current address for me?,False,
6941b4ed-b5d9-451b-8ffc-ee80b4904702,6,customer,"Yes, it's 123 Elm Street, Springfield.",False,
6941b4ed-b5d9-451b-8ffc-ee80b4904702,7,agent,"Great, I have verified your identity. You currently have a balance of $250. How would you like to proceed with the payment?",False,
6941b4ed-b5d9-451b-8ffc-ee80b4904702,8,customer,"I can pay half of it today, about $125.",False,
6941b4ed-b5d9-451b-8ffc-ee80b4904702,9,agent,That sounds good. Would you like to make that payment by credit card or bank transfer?,False,
6941b4ed-b5d9-451b-8ffc-ee80b4904702,10,customer,I’ll use my credit card.,False,
6941b4ed-b5d9-451b-8ffc-ee80b4904702,11,agent,Perfect. Please hold on while I process that for you.,False,
6941b4ed-b5d9-451b-8ffc-ee80b4904702,12,customer,"Sure, take your time.",False,
6941b4ed-b5d9-451b-8ffc-ee80b4904702,13,agent,Thank you for your patience. Your payment has been processed successfully. Is there anything else I can assist you with today?,False,
6941b4ed-b5d9-451b-8ffc-ee80b4904702,14,customer,"No, that's all. Thank you!",False,
6941b4ed-b5d9-451b-8ffc-ee80b4904702,15,agent,You're welcome! Have a great day!,False,
2ca5c9fd-f516-4a89-b25e-8de0ccc16fc3,1,agent,"Hello, this is Michael calling from XYZ Collections. How are you today?",False,
2ca5c9fd-f516-4a89-b25e-8de0ccc16fc3,2,customer,"Hi Michael, I'm doing well, thank you. What is this about?",False,
2ca5c9fd-f516-4a89-b25e-8de0ccc16fc3,3,agent,"I'm reaching out regarding your outstanding account. Before we proceed, could you please verify your date of birth?",False,
2ca5c9fd-f516-4a89-b25e-8de0ccc16fc3,4,customer,"Sure, it's April 15th, 1990.",False,
2ca5c9fd-f516-4a89-b25e-8de0ccc16fc3,5,agent,Thank you for that. Can you also confirm your address for security purposes?,False,
2ca5c9fd-f516-4a89-b25e-8de0ccc16fc3,6,customer,"Yes, it's 123 Maple Street, Springfield.",False,
2ca5c9fd-f516-4a89-b25e-8de0ccc16fc3,7,agent,I appreciate your cooperation. I see you have a balance of $250. How would you like to resolve this today?,False,
2ca5c9fd-f516-4a89-b25e-8de0ccc16fc3,8,customer,I can make a payment of $100 right now via credit card.,False,
2ca5c9fd-f516-4a89-b25e-8de0ccc16fc3,9,agent,That sounds good. I will process that for you. Can you provide your card information?,False,
2ca5c9fd-f516-4a89-b25e-8de0ccc16fc3,10,customer,"Sure, it's 4111 1111 1111 1111, expiration date 12/25.",False,
2ca5c9fd-f516-4a89-b25e-8de0ccc16fc3,11,agent,"Thank you. Your payment is being processed, and you'll receive a confirmation shortly.",False,
2ca5c9fd-f516-4a89-b25e-8de0ccc16fc3,12,customer,"Great, thank you for your help!",False,
2ca5c9fd-f516-4a89-b25e-8de0ccc16fc3,13,agent,You're welcome! Have a wonderful day.,False,
2ca5c9fd-f516-4a89-b25e-8de0ccc16fc3,14,customer,"You too, goodbye!",False,
8706edf5-aa69-4338-b09a-122d2e9aa584,1,agent,"Hello, is this David Johnson?",False,
8706edf5-aa69-4338-b09a-122d2e9aa584,2,customer,"Yes, this is David. Who's calling?",False,
8706edf5-aa69-4338-b09a-122d2e9aa584,3,agent,This is Sarah from XYZ Collections. How are you today?,False,
8706edf5-aa69-4338-b09a-122d2e9aa584,4,customer,"I'm doing well, thanks. What's this about?",False,
8706edf5-aa69-4338-b09a-122d2e9aa584,5,agent,"I’m reaching out regarding an outstanding balance on your account. Before we proceed, can you please verify your date of birth?",False,
8706edf5-aa69-4338-b09a-122d2e9aa584,6,customer,"Sure, it’s July 15, 1990.",False,
8706edf5-aa69-4338-b09a-122d2e9aa584,7,agent,"Thank you, David. Can you also confirm your current address for verification?",False,
8706edf5-aa69-4338-b09a-122d2e9aa584,8,customer,"Yes, it’s 123 Maple Street, Springfield.",False,
8706edf5-aa69-4338-b09a-122d2e9aa584,9,agent,Thank you for confirming that information. You have a balance of $250 due. How would you like to resolve this today?,False,
8706edf5-aa69-4338-b09a-122d2e9aa584,10,customer,I can pay half of it today and the rest next month.,False,
8706edf5-aa69-4338-b09a-122d2e9aa584,11,agent,"That sounds reasonable. So, you would like to pay $125 today?",False,
8706edf5-aa69-4338-b09a-122d2e9aa584,12,customer,"Yes, that's correct.",False,
8706edf5-aa69-4338-b09a-122d2e9aa584,13,agent,"Great! I will set that up for you. Thank you for your time, David.",False,
8706edf5-aa69-4338-b09a-122d2e9aa584,14,customer,"Thank you, Sarah. Talk to you soon.",False,
bf973b43-76ec-41a6-af68-a3b4bc4b69b3,1,agent,"Hello, this is Mike from XYZ Collections. How the hell are you?",True,hell
bf973b43-76ec-41a6-af68-a3b4bc4b69b3,2,customer,"I’m well, thank you. How can I help you today?",False,
bf973b43-76ec-41a6-af68-a3b4bc4b69b3,3,agent,"I’m calling about the overdue balance on your account. You owe quite a bit of money, and I need to sort this out.",False,
bf973b43-76ec-41a6-af68-a3b4bc4b69b3,4,customer,I understand. Could you provide me with the specific details?,False,
