call_id,utterance_number,speaker,text,has_profanity,profane_words
656fdb00-a46e-4a96-92cd-894eeea08829,1,agent,"Hello, this is Mark from XYZ Collections. Am I speaking with Jessica?",False,
656fdb00-a46e-4a96-92cd-894eeea08829,2,customer,"No, this is not Jessica. You have the wrong number.",False,
656fdb00-a46e-4a96-92cd-894eeea08829,3,agent,I apologize for the mix-up. I'm calling about an outstanding balance with your account.,False,
656fdb00-a46e-4a96-92cd-894eeea08829,4,customer,I really think you need to check your records. I have no account with you.,False,
656fdb00-a46e-4a96-92cd-894eeea08829,5,agent,I'm very sorry for the inconvenience. I'll make sure to update our records.,False,
656fdb00-a46e-4a96-92cd-894eeea08829,6,customer,Thank you for understanding.,False,
656fdb00-a46e-4a96-92cd-894eeea08829,7,agent,Of course! Thank you for your patience. Have a great day!,False,
019b9e97-9575-459e-9893-b59d8c99acef,1,agent,"Hello, this is Jason calling from XYZ Collections. How are you today?",False,
019b9e97-9575-459e-9893-b59d8c99acef,2,customer,"I'm okay, but why are you calling me?",False,
019b9e97-9575-459e-9893-b59d8c99acef,3,agent,I'm reaching out regarding your overdue balance on your account. I just wanted to discuss your payment options.,False,
019b9e97-9575-459e-9893-b59d8c99acef,4,customer,I already requested to be on your do not call list last month.,False,
019b9e97-9575-459e-9893-b59d8c99acef,5,agent,I apologize for the inconvenience. Let me check that for you and ensure your number is marked correctly.,False,
019b9e97-9575-459e-9893-b59d8c99acef,6,customer,Please do it quickly. I don’t want to hear from you again.,False,
019b9e97-9575-459e-9893-b59d8c99acef,7,agent,Absolutely. I’ll mark your number as do not call right now.,False,
019b9e97-9575-459e-9893-b59d8c99acef,8,customer,"Thank you, I hope this is the last call.",False,
019b9e97-9575-459e-9893-b59d8c99acef,9,agent,You're welcome! I've completed the request. You won't receive any further calls.,False,
73a011af-5fcc-458b-9ae5-48c7367eab5d,1,agent,"Hello, this is Sarah from XYZ Collections. How are you today?",False,
73a011af-5fcc-458b-9ae5-48c7367eab5d,2,customer,"I'm doing alright, thanks. What is this about?",False,
73a011af-5fcc-458b-9ae5-48c7367eab5d,3,agent,I'm glad to hear that. I'm calling regarding an outstanding account. Can you please confirm your date of birth for verification?,False,
73a011af-5fcc-458b-9ae5-48c7367eab5d,4,customer,"Sure, it's February 14th, 1990.",False,
73a011af-5fcc-458b-9ae5-48c7367eab5d,5,agent,Thank you for that. Could you also provide your current address to further verify your identity?,False,
73a011af-5fcc-458b-9ae5-48c7367eab5d,6,customer,"Yes, I live at 123 Maple Street, Springfield.",False,
73a011af-5fcc-458b-9ae5-48c7367eab5d,7,agent,I appreciate your confirmation. You currently have a balance of $450 on your account. How would you like to proceed with the payment?,False,
73a011af-5fcc-458b-9ae5-48c7367eab5d,8,customer,I can pay $100 today and the rest later.,False,
73a011af-5fcc-458b-9ae5-48c7367eab5d,9,agent,That sounds good. I can help you process that payment right now. Would you like to use a credit card?,False,
73a011af-5fcc-458b-9ae5-48c7367eab5d,10,customer,"Yes, I'll use my Visa card.",False,
73a011af-5fcc-458b-9ae5-48c7367eab5d,11,agent,Perfect. Can you please provide me with the card number?,False,
73a011af-5fcc-458b-9ae5-48c7367eab5d,12,customer,It's 4111 1111 1111 1111.,False,
73a011af-5fcc-458b-9ae5-48c7367eab5d,13,agent,Thank you. Just one moment while I process that for you.,False,
73a011af-5fcc-458b-9ae5-48c7367eab5d,14,customer,"Okay, I'm waiting.",False,
73a011af-5fcc-458b-9ae5-48c7367eab5d,15,agent,All done! Your payment has been processed. Thank you for your cooperation.,False,
348f6912-9877-4576-b0b2-4bcba9858515,1,agent,"Hello, this is Lisa from Secure Collections. How are you today?",False,
348f6912-9877-4576-b0b2-4bcba9858515,2,customer,"I'm doing well, thank you. What’s this call about?",False,
348f6912-9877-4576-b0b2-4bcba9858515,3,agent,"I’m calling regarding an outstanding balance on your account. First, could you please verify your date of birth?",False,
348f6912-9877-4576-b0b2-4bcba9858515,4,customer,"Sure, it's April 15, 1990.",False,
348f6912-9877-4576-b0b2-4bcba9858515,5,agent,Thank you for that information. Can you also confirm your current address?,False,
348f6912-9877-4576-b0b2-4bcba9858515,6,customer,"Yes, it's 123 Maple Street, Springfield.",False,
348f6912-9877-4576-b0b2-4bcba9858515,7,agent,Thank you for confirming your identity. You currently have a balance of $250 on your account. Would you like to discuss a payment option?,False,
348f6912-9877-4576-b0b2-4bcba9858515,8,customer,I can make a payment today. What are my options?,False,
348f6912-9877-4576-b0b2-4bcba9858515,9,agent,"You can pay by credit card, bank transfer, or set up a payment plan. Which would you prefer?",False,
348f6912-9877-4576-b0b2-4bcba9858515,10,customer,I’d like to pay by credit card.,False,
348f6912-9877-4576-b0b2-4bcba9858515,11,agent,Great! I can help you with that. Please provide your credit card details.,False,
348f6912-9877-4576-b0b2-4bcba9858515,12,customer,"Okay, my card number is 4111 1111 1111 1111.",False,
348f6912-9877-4576-b0b2-4bcba9858515,13,agent,Thank you! I've processed your payment. You’ll receive a confirmation email shortly.,False,
348f6912-9877-4576-b0b2-4bcba9858515,14,customer,Thank you for your help.,False,
348f6912-9877-4576-b0b2-4bcba9858515,15,agent,You’re welcome! Have a great day!,False,
fa8af38b-d3f8-415c-a69b-e28dccf8af99,1,agent,"Hello, is this Mr. Johnson? This is Sarah calling from XYZ Collections.",False,
fa8af38b-d3f8-415c-a69b-e28dccf8af99,2,customer,"Yes, this is Mr. Johnson speaking. How can I help you?",False,
fa8af38b-d3f8-415c-a69b-e28dccf8af99,3,agent,I'm calling today regarding an outstanding balance on your account. Can I take a moment of your time to discuss this?,False,
fa8af38b-d3f8-415c-a69b-e28dccf8af99,4,customer,"Sure, I have a moment. What is the balance?",False,
fa8af38b-d3f8-415c-a69b-e28dccf8af99,5,agent,Thank you. You currently have a balance of three hundred dollars due. Can you confirm your phone number for account verification?,False,
fa8af38b-d3f8-415c-a69b-e28dccf8af99,6,customer,"It's 555-123-4567, but why do you need that?",False,
fa8af38b-d3f8-415c-a69b-e28dccf8af99,7,agent,"I appreciate that. As I mentioned, your balance is three hundred dollars. How would you like to proceed with the payment?",False,
fa8af38b-d3f8-415c-a69b-e28dccf8af99,8,customer,I’m not sure I can pay the full amount right now.,False,
fa8af38b-d3f8-415c-a69b-e28dccf8af99,9,agent,I understand. We can discuss payment plans or options to help you settle this balance.,False,
fa8af38b-d3f8-415c-a69b-e28dccf8af99,10,customer,That would be helpful. What do you suggest?,False,
fa8af38b-d3f8-415c-a69b-e28dccf8af99,11,agent,We could set up a payment plan where you pay a hundred dollars a month for three months. Does that work for you?,False,
fa8af38b-d3f8-415c-a69b-e28dccf8af99,12,customer,"Yes, that sounds manageable.",False,
fa8af38b-d3f8-415c-a69b-e28dccf8af99,13,agent,Great! I’ll send you a confirmation email with the details. Thank you for your cooperation today.,False,
fa8af38b-d3f8-415c-a69b-e28dccf8af99,14,customer,Thank you! I appreciate your help.,False,
fa8af38b-d3f8-415c-a69b-e28dccf8af99,15,agent,"You're welcome! If you have any further questions, feel free to reach out. Have a great day!",False,
b8553ad6-58ac-4104-b081-b73ca0749d2b,1,agent,"Hello, this is Mark calling from XYZ Collections. How are you today?",False,
b8553ad6-58ac-4104-b081-b73ca0749d2b,2,customer,"I’m doing well, thank you. What’s this about?",False,
b8553ad6-58ac-4104-b081-b73ca0749d2b,3,agent,"I’m reaching out regarding an outstanding balance on your account. To protect your privacy, may I have your date of birth for verification?",False,
b8553ad6-58ac-4104-b081-b73ca0749d2b,4,customer,"Sure, it’s January 15, 1985.",False,
b8553ad6-58ac-4104-b081-b73ca0749d2b,5,agent,Thank you for that information. Can you also confirm your current address?,False,
b8553ad6-58ac-4104-b081-b73ca0749d2b,6,customer,"Yes, it’s 123 Main Street, Springfield.",False,
b8553ad6-58ac-4104-b081-b73ca0749d2b,7,agent,Thank you for the verification. I see you have a balance of three hundred dollars. Would you like to discuss payment options?,False,
b8553ad6-58ac-4104-b081-b73ca0749d2b,8,customer,I can do a payment plan. What do you suggest?,False,
b8553ad6-58ac-4104-b081-b73ca0749d2b,9,agent,We can set up a plan for monthly payments of one hundred dollars for three months. Does that work for you?,False,
b8553ad6-58ac-4104-b081-b73ca0749d2b,10,customer,That sounds manageable. I agree.,False,
b8553ad6-58ac-4104-b081-b73ca0749d2b,11,agent,Great! I’ll set that up for you. You’ll receive a confirmation email shortly.,False,
b8553ad6-58ac-4104-b081-b73ca0749d2b,12,customer,Thank you for your help!,False,
b8553ad6-58ac-4104-b081-b73ca0749d2b,13,agent,"You're welcome! If you have any questions, feel free to reach out. Have a great day!",False,
a033d0d6-eb56-4cc8-8e31-0a00c7c94607,1,agent,"Hello, this is Mark calling from XYZ Collections. Am I speaking with Sarah?",False,
a033d0d6-eb56-4cc8-8e31-0a00c7c94607,2,customer,"No, this is not Sarah. You have the wrong number.",False,
a033d0d6-eb56-4cc8-8e31-0a00c7c94607,3,agent,I apologize for the mix-up. I'm calling about an outstanding balance on an account.,False,
a033d0d6-eb56-4cc8-8e31-0a00c7c94607,4,customer,I really don't think I know anything about that.,False,
a033d0d6-eb56-4cc8-8e31-0a00c7c94607,5,agent,Could you confirm your name to ensure I'm not reaching the right person?,False,
a033d0d6-eb56-4cc8-8e31-0a00c7c94607,6,customer,"Sure, my name is Emily, and I don’t have any accounts with your company.",False,
a033d0d6-eb56-4cc8-8e31-0a00c7c94607,7,agent,"Thank you, Emily. I’ll make sure to update our records.",False,
a033d0d6-eb56-4cc8-8e31-0a00c7c94607,8,customer,I appreciate that. Have a good day.,False,
a033d0d6-eb56-4cc8-8e31-0a00c7c94607,9,agent,You too! Take care.,False,
f3d61724-540e-4665-837d-95c662b34a84,1,agent,"Hello, this is Jessica from XYZ Collections. How are you today?",False,
f3d61724-540e-4665-837d-95c662b34a84,2,customer,"I'm fine, but what's this about?",False,
f3d61724-540e-4665-837d-95c662b34a84,3,agent,I'm calling regarding your outstanding balance with ABC Credit Card. This call is to discuss your account.,False,
f3d61724-540e-4665-837d-95c662b34a84,4,customer,I've requested several times to stop calling me.,False,
f3d61724-540e-4665-837d-95c662b34a84,5,agent,I apologize for the inconvenience. I can help you with that. Would you like me to mark your number as do not call?,False,
f3d61724-540e-4665-837d-95c662b34a84,6,customer,"Yes, please do that. I don't want any more calls.",False,
f3d61724-540e-4665-837d-95c662b34a84,7,agent,Got it! I'll mark your number on the do not call list immediately.,False,
f3d61724-540e-4665-837d-95c662b34a84,8,customer,"Thank you, I appreciate it.",False,
f3d61724-540e-4665-837d-95c662b34a84,9,agent,You're welcome! Your request has been processed. Have a great day!,False,
708878fa-108e-4c22-b7bf-1d5c38227087,1,agent,"Hello, this is Mark from XYZ Collections. How are you today?",False,
708878fa-108e-4c22-b7bf-1d5c38227087,2,customer,What the hell do you want? I'm sick of this crap!,True,"crap, hell, sick"
708878fa-108e-4c22-b7bf-1d5c38227087,3,agent,I understand you're frustrated. I'm calling regarding your overdue account.,False,
708878fa-108e-4c22-b7bf-1d5c38227087,4,customer,Yeah? And what gives you the right to bother me? You are all a bunch of idiots!,False,
708878fa-108e-4c22-b7bf-1d5c38227087,5,agent,I assure you that we're here to help. Can I get your account number to assist you further?,False,
708878fa-108e-4c22-b7bf-1d5c38227087,6,customer,You think I'm just going to give you my info? Screw you!,True,screw
708878fa-108e-4c22-b7bf-1d5c38227087,7,agent,"I understand your hesitation; however, I need that to proceed. Your current balance is fifty dollars.",False,
708878fa-108e-4c22-b7bf-1d5c38227087,8,customer,I don't care about that! Just stop calling me already!,False,
708878fa-108e-4c22-b7bf-1d5c38227087,9,agent,I can help you set up a payment plan if that works for you. Let's find a solution.,False,
708878fa-108e-4c22-b7bf-1d5c38227087,10,customer,Solution? You're just a leech! Leave me the hell alone!,True,hell
708878fa-108e-4c22-b7bf-1d5c38227087,11,agent,I truly apologize for the inconvenience. My goal is to help you resolve this matter efficiently.,False,
708878fa-108e-4c22-b7bf-1d5c38227087,12,customer,I don't need your help! Just f*** off!,False,
708878fa-108e-4c22-b7bf-1d5c38227087,13,agent,"I respect your feelings. If you need assistance in the future, please don't hesitate to reach out.",False,
708878fa-108e-4c22-b7bf-1d5c38227087,14,customer,"Whatever, just go away!",False,
708878fa-108e-4c22-b7bf-1d5c38227087,15,agent,Thank you for your time. Have a good day.,False,
43bb3199-b004-41ef-a7da-1ae746f1567c,1,agent,"Hello, this is Sarah from XYZ Collections. How are you doing today?",False,
43bb3199-b004-41ef-a7da-1ae746f1567c,2,customer,"I'm alright, thanks. What’s this about?",False,
43bb3199-b004-41ef-a7da-1ae746f1567c,3,agent,I'm reaching out regarding your outstanding balance with City Bank. Can you please confirm your date of birth for verification?,False,
43bb3199-b004-41ef-a7da-1ae746f1567c,4,customer,"It's July 15, 1990.",False,
43bb3199-b004-41ef-a7da-1ae746f1567c,5,agent,Thank you for that. Could you also provide your current address?,False,
43bb3199-b004-41ef-a7da-1ae746f1567c,6,customer,"Sure, it's 123 Maple Street, Springfield.",False,
43bb3199-b004-41ef-a7da-1ae746f1567c,7,agent,"Great, I have verified your identity. You currently have a balance of $250.",False,
43bb3199-b004-41ef-a7da-1ae746f1567c,8,customer,I wasn't aware of that amount. How can I pay?,False,
43bb3199-b004-41ef-a7da-1ae746f1567c,9,agent,You can pay by credit card over the phone or through our online portal. Which method would you prefer?,False,
43bb3199-b004-41ef-a7da-1ae746f1567c,10,customer,"I'd like to pay by credit card, please.",False,
43bb3199-b004-41ef-a7da-1ae746f1567c,11,agent,Perfect! I will guide you through the process. Can you please provide your card number?,False,
43bb3199-b004-41ef-a7da-1ae746f1567c,12,customer,"Sure, it's 4111 1111 1111 1111.",False,
43bb3199-b004-41ef-a7da-1ae746f1567c,13,agent,Thank you! Let me process that for you.,False,
43bb3199-b004-41ef-a7da-1ae746f1567c,14,customer,"Okay, thank you for your help.",False,
43bb3199-b004-41ef-a7da-1ae746f1567c,15,agent,You’re welcome! Your payment has been processed successfully. Have a great day!,False,
b8bf9022-4917-42b9-a6b7-cfa28ee305ad,1,agent,"Hello, this is Mark from XYZ Collections. How are you doing today?",False,
b8bf9022-4917-42b9-a6b7-cfa28ee305ad,2,customer,"Hi Mark, I'm doing well, thank you. What’s this about?",False,
b8bf9022-4917-42b9-a6b7-cfa28ee305ad,3,agent,"I’m calling regarding a past due account with Prime Bank. Before we proceed, could you please verify your address?",False,
b8bf9022-4917-42b9-a6b7-cfa28ee305ad,4,customer,"Sure, it's 123 Elm Street, Springfield.",False,
b8bf9022-4917-42b9-a6b7-cfa28ee305ad,5,agent,Thank you for that. Could you also provide your date of birth for verification?,False,
b8bf9022-4917-42b9-a6b7-cfa28ee305ad,6,customer,"It's January 15th, 1990.",False,
b8bf9022-4917-42b9-a6b7-cfa28ee305ad,7,agent,"Great, thank you for confirming your identity. You currently have a balance of $450 on your account.",False,
b8bf9022-4917-42b9-a6b7-cfa28ee305ad,8,customer,"Oh, I didn't realize it was that much. What are my options for payment?",False,
b8bf9022-4917-42b9-a6b7-cfa28ee305ad,9,agent,"You can pay the full amount today, or we can set up a payment plan for you.",False,
b8bf9022-4917-42b9-a6b7-cfa28ee305ad,10,customer,I think I can pay $150 today and set up a plan for the rest.,False,
b8bf9022-4917-42b9-a6b7-cfa28ee305ad,11,agent,That sounds good. I’ll help you set up the payment plan for the remaining balance. Thank you for cooperating.,False,
b8bf9022-4917-42b9-a6b7-cfa28ee305ad,12,customer,Thank you for your understanding.,False,
b8bf9022-4917-42b9-a6b7-cfa28ee305ad,13,agent,You're welcome. I’ll send you the confirmation of the payment details shortly.,False,
b8bf9022-4917-42b9-a6b7-cfa28ee305ad,14,customer,"Great, I’ll keep an eye out for it.",False,
b8bf9022-4917-42b9-a6b7-cfa28ee305ad,15,agent,Thank you for your time today. Have a wonderful day!,False,
c46407f6-d657-47ab-9ed7-1c31d5cc8a4e,1,agent,"Hello, this is Mark from XYZ Collections. How are you today?",False,
c46407f6-d657-47ab-9ed7-1c31d5cc8a4e,2,customer,"Hi Mark, I'm doing well, thanks. What's this about?",False,
c46407f6-d657-47ab-9ed7-1c31d5cc8a4e,3,agent,I'm calling about your outstanding balance with ABC Credit Card. Can you confirm your last name for me?,False,
c46407f6-d657-47ab-9ed7-1c31d5cc8a4e,4,customer,It's Johnson.,False,
c46407f6-d657-47ab-9ed7-1c31d5cc8a4e,5,agent,"Thank you, Mr. Johnson. I see you have a balance of $450. Can we discuss payment options?",False,
c46407f6-d657-47ab-9ed7-1c31d5cc8a4e,6,customer,I wasn't aware of that amount. Can you tell me more about the charges?,False,
c46407f6-d657-47ab-9ed7-1c31d5cc8a4e,7,agent,Sure! The charges include recent purchases and some fees. Would you like to set up a payment plan?,False,
c46407f6-d657-47ab-9ed7-1c31d5cc8a4e,8,customer,"I would consider that, but I need to review my statement first.",False,
c46407f6-d657-47ab-9ed7-1c31d5cc8a4e,9,agent,"Absolutely, I can send you a detailed statement. Would you prefer it via email or postal mail?",False,
c46407f6-d657-47ab-9ed7-1c31d5cc8a4e,10,customer,"Email would be best, please.",False,
c46407f6-d657-47ab-9ed7-1c31d5cc8a4e,11,agent,"Got it! I'll send that over. Just for confirmation, can you provide your email address?",False,
c46407f6-d657-47ab-9ed7-1c31d5cc8a4e,12,customer,"Sure, it's johnson.family@email.com.",False,
c46407f6-d657-47ab-9ed7-1c31d5cc8a4e,13,agent,"Thank you, Mr. Johnson. I’ll send the statement shortly. Anything else I can assist you with?",False,
c46407f6-d657-47ab-9ed7-1c31d5cc8a4e,14,customer,"No, that's all for now. Thanks for your help!",False,
c46407f6-d657-47ab-9ed7-1c31d5cc8a4e,15,agent,You're welcome! Have a great day!,False,
1937fe41-0ba0-4276-b5cb-50524b28080a,1,agent,"Hello, is this Mr. Johnson? This is Lisa from XYZ Collections. How are you today?",False,
1937fe41-0ba0-4276-b5cb-50524b28080a,2,customer,"Hi Lisa, yes this is Mr. Johnson. I'm doing okay, thanks.",False,
1937fe41-0ba0-4276-b5cb-50524b28080a,3,agent,I’m glad to hear that! I'm calling regarding your outstanding balance with XYZ Credit. Can you confirm your address for me?,False,
1937fe41-0ba0-4276-b5cb-50524b28080a,4,customer,"Sure, it's 123 Elm Street.",False,
1937fe41-0ba0-4276-b5cb-50524b28080a,5,agent,Thank you. I see you have a balance of $350. Would you like to discuss payment options?,False,
1937fe41-0ba0-4276-b5cb-50524b28080a,6,customer,I didn't expect that. Can you give me more details about the charges?,False,
1937fe41-0ba0-4276-b5cb-50524b28080a,7,agent,Of course! This balance is from your last statement dated July 15th. We can discuss how to settle this today.,False,
1937fe41-0ba0-4276-b5cb-50524b28080a,8,customer,I need some time to think about it. Can I call back later?,False,
1937fe41-0ba0-4276-b5cb-50524b28080a,9,agent,"Sure, I understand. Just to let you know, you can pay online or through our automated system anytime.",False,
1937fe41-0ba0-4276-b5cb-50524b28080a,10,customer,"Alright, I’ll look into that. Thanks for the information.",False,
1937fe41-0ba0-4276-b5cb-50524b28080a,11,agent,"You’re welcome, Mr. Johnson. If you have any further questions, feel free to reach out.",False,
1937fe41-0ba0-4276-b5cb-50524b28080a,12,customer,"I appreciate it, Lisa. Talk to you later.",False,
1937fe41-0ba0-4276-b5cb-50524b28080a,13,agent,"Goodbye, take care!",False,
54d23e27-49e7-4161-98f9-ff50c737577e,1,agent,"Hello, this is Mark calling from XYZ Collections. How are you today?",False,
54d23e27-49e7-4161-98f9-ff50c737577e,2,customer,"I'm doing okay, thanks. What is this about?",False,
54d23e27-49e7-4161-98f9-ff50c737577e,3,agent,"I'm reaching out regarding a past due account. Before we proceed, could you please confirm your date of birth?",False,
54d23e27-49e7-4161-98f9-ff50c737577e,4,customer,"Sure, it's June 15, 1990.",False,
54d23e27-49e7-4161-98f9-ff50c737577e,5,agent,Thank you for that. Could you also provide your current address to verify your identity?,False,
54d23e27-49e7-4161-98f9-ff50c737577e,6,customer,"I live at 123 Maple Street, Springfield.",False,
54d23e27-49e7-4161-98f9-ff50c737577e,7,agent,"Great, I’ve verified your identity. You currently have an outstanding balance of $250. How do you plan to address this today?",False,
54d23e27-49e7-4161-98f9-ff50c737577e,8,customer,I can pay $50 right now and schedule the rest for next week.,False,
54d23e27-49e7-4161-98f9-ff50c737577e,9,agent,That sounds reasonable. Let’s set up that $50 payment. How would you like to pay?,False,
54d23e27-49e7-4161-98f9-ff50c737577e,10,customer,I’ll use my credit card for that.,False,
54d23e27-49e7-4161-98f9-ff50c737577e,11,agent,"Okay, I’ll process that for you. Can you please provide your credit card number?",False,
54d23e27-49e7-4161-98f9-ff50c737577e,12,customer,It's 4111-1111-1111-1111.,False,
54d23e27-49e7-4161-98f9-ff50c737577e,13,agent,Thank you. I’ll process this payment right away. You're all set. Is there anything else you need?,False,
54d23e27-49e7-4161-98f9-ff50c737577e,14,customer,"No, that’s all. Thank you for your help.",False,
54d23e27-49e7-4161-98f9-ff50c737577e,15,agent,You're welcome! Have a great day!,False,
0d825dd5-99b2-4edd-af24-e39952ac84d5,1,customer,You have reached the voicemail of John Smith. Please leave a message after the beep.,False,
0d825dd5-99b2-4edd-af24-e39952ac84d5,2,agent,"Hello, John. This is Lisa from Greenfield Collections. I wanted to discuss your account balance.",False,
0d825dd5-99b2-4edd-af24-e39952ac84d5,3,customer,"If you need immediate assistance, please send an email.",False,
0d825dd5-99b2-4edd-af24-e39952ac84d5,4,agent,You can reach me at 1-800-555-0199. It's important to address this matter as soon as possible.,False,
0d825dd5-99b2-4edd-af24-e39952ac84d5,5,customer,Thank you for your call. I'll return it as soon as I can.,False,
36216c4a-0dcd-4d93-ab06-4ed14682d1a3,1,agent,"Hello, this is Mark from XYZ Collections. How are you today?",False,
36216c4a-0dcd-4d93-ab06-4ed14682d1a3,2,customer,"I'm doing alright, thank you. What's this about?",False,
36216c4a-0dcd-4d93-ab06-4ed14682d1a3,3,agent,I'm calling regarding your outstanding balance with your credit card account. Can you confirm your mailing address?,False,
36216c4a-0dcd-4d93-ab06-4ed14682d1a3,4,customer,"Sure, it's 123 Maple Street.",False,
36216c4a-0dcd-4d93-ab06-4ed14682d1a3,5,agent,Thank you. I see here you have a balance of $500. How would you like to handle that today?,False,
36216c4a-0dcd-4d93-ab06-4ed14682d1a3,6,customer,I’m not sure. I’ve been meaning to call about that.,False,
36216c4a-0dcd-4d93-ab06-4ed14682d1a3,7,agent,I understand. It's important to address this. You can set up a payment plan if that helps!,False,
36216c4a-0dcd-4d93-ab06-4ed14682d1a3,8,customer,"I need more information before I decide, can you provide details?",False,
36216c4a-0dcd-4d93-ab06-4ed14682d1a3,9,agent,Of course! The balance is from your last purchase and some fees. Would you like to know the due date?,False,
36216c4a-0dcd-4d93-ab06-4ed14682d1a3,10,customer,"Yes, please.",False,
36216c4a-0dcd-4d93-ab06-4ed14682d1a3,11,agent,The due date is October 15th. You can pay online or through mail. How would you prefer?,False,
36216c4a-0dcd-4d93-ab06-4ed14682d1a3,12,customer,"I'll likely pay online, but I need some time to consider my options first.",False,
36216c4a-0dcd-4d93-ab06-4ed14682d1a3,13,agent,That’s completely understandable. Please let us know if you have any other questions!,False,
36216c4a-0dcd-4d93-ab06-4ed14682d1a3,14,customer,Thanks for the information.,False,
36216c4a-0dcd-4d93-ab06-4ed14682d1a3,15,agent,You're welcome! Have a great day!,False,
7cfd0c78-fa7a-4488-9b62-f478f7609089,1,agent,"Hello, this is Mark calling from XYZ Collections. How are you today?",False,
7cfd0c78-fa7a-4488-9b62-f478f7609089,2,customer,"I'm doing well, thank you. What's this about?",False,
7cfd0c78-fa7a-4488-9b62-f478f7609089,3,agent,"I’m reaching out regarding an account linked to you. Before we proceed, could you please confirm your date of birth?",False,
7cfd0c78-fa7a-4488-9b62-f478f7609089,4,customer,"Sure, it's July 15, 1990.",False,
7cfd0c78-fa7a-4488-9b62-f478f7609089,5,agent,Thank you for that. Could you also provide your current address for verification?,False,
7cfd0c78-fa7a-4488-9b62-f478f7609089,6,customer,"I live at 123 Maple Street, Springfield.",False,
7cfd0c78-fa7a-4488-9b62-f478f7609089,7,agent,"Great, I have verified your information. You have an outstanding balance of $450. How would you like to handle that today?",False,
7cfd0c78-fa7a-4488-9b62-f478f7609089,8,customer,I can make a payment over the phone right now.,False,
7cfd0c78-fa7a-4488-9b62-f478f7609089,9,agent,Perfect! I can guide you through the payment process. Do you have your payment method ready?,False,
7cfd0c78-fa7a-4488-9b62-f478f7609089,10,customer,"Yes, I have my credit card here.",False,
7cfd0c78-fa7a-4488-9b62-f478f7609089,11,agent,"Alright, please provide the card number when you're ready.",False,
7cfd0c78-fa7a-4488-9b62-f478f7609089,12,customer,It's 4111 1111 1111 1111.,False,
7cfd0c78-fa7a-4488-9b62-f478f7609089,13,agent,Thank you. I will process that payment now. You’ll receive a confirmation shortly.,False,
