call_id,utterance_number,speaker,text,has_profanity,profane_words
4832c70d-36a2-40be-a926-b596fd71dafe,4,agent,"Again, that's Sarah from Apex Collections. We need to discuss your payment options. Thank you for your attention.",False,
4832c70d-36a2-40be-a926-b596fd71dafe,5,customer,Have a great day! Goodbye.,False,
e1e872ea-33c5-49c1-b6f6-8bc2166d77b0,1,agent,"Hello, is this Mr. Smith?",False,
e1e872ea-33c5-49c1-b6f6-8bc2166d77b0,2,customer,"Yes, this is him. Who's calling?",False,
e1e872ea-33c5-49c1-b6f6-8bc2166d77b0,3,agent,This is Sarah from XYZ Recovery. I'm calling about an outstanding balance on your account. Can you please verify your date of birth?,False,
e1e872ea-33c5-49c1-b6f6-8bc2166d77b0,4,customer,"Sure, it's April 15, 1985.",False,
e1e872ea-33c5-49c1-b6f6-8bc2166d77b0,5,agent,"Thank you for that information, Mr. Smith. Can you also confirm your address for me?",False,
e1e872ea-33c5-49c1-b6f6-8bc2166d77b0,6,customer,"Yes, it's 123 Elm Street, Springfield.",False,
e1e872ea-33c5-49c1-b6f6-8bc2166d77b0,7,agent,Thank you for verifying that. You currently have a balance of $650. How would you like to proceed with payment?,False,
e1e872ea-33c5-49c1-b6f6-8bc2166d77b0,8,customer,I can make a payment today. How do I do that?,False,
e1e872ea-33c5-49c1-b6f6-8bc2166d77b0,9,agent,We can process a payment over the phone or you can also pay online. Which would you prefer?,False,
e1e872ea-33c5-49c1-b6f6-8bc2166d77b0,10,customer,"I'll pay online, that’s easier for me.",False,
e1e872ea-33c5-49c1-b6f6-8bc2166d77b0,11,agent,Great! I will send you an email with the payment link shortly.,False,
e1e872ea-33c5-49c1-b6f6-8bc2166d77b0,12,customer,Thank you for your help.,False,
e1e872ea-33c5-49c1-b6f6-8bc2166d77b0,13,agent,"You're welcome, Mr. Smith. If you have any other questions, feel free to reach out. Have a great day!",False,
0b6979e4-8c05-49e1-b7a7-94d85a627df5,1,agent,"Hello, this is Mark from XYZ Collections. Am I speaking with Jessica?",False,
0b6979e4-8c05-49e1-b7a7-94d85a627df5,2,customer,"Yes, this is Jessica. What is this about?",False,
0b6979e4-8c05-49e1-b7a7-94d85a627df5,3,agent,I’m calling regarding an outstanding balance on your account. Could you please verify your address for me?,False,
0b6979e4-8c05-49e1-b7a7-94d85a627df5,4,customer,"Sure, it's 123 Elm Street, Springfield.",False,
0b6979e4-8c05-49e1-b7a7-94d85a627df5,5,agent,Thank you. I see here that you have a balance of $450 due. When do you plan to make a payment?,False,
0b6979e4-8c05-49e1-b7a7-94d85a627df5,6,customer,I didn't know I had a balance. Can you provide more details?,False,
0b6979e4-8c05-49e1-b7a7-94d85a627df5,7,agent,Sure! This balance is from services rendered last month. Can I assist you with the payment plan?,False,
0b6979e4-8c05-49e1-b7a7-94d85a627df5,8,customer,I need to check my finances first before committing.,False,
0b6979e4-8c05-49e1-b7a7-94d85a627df5,9,agent,"Of course, take your time. Just to confirm, do you want to set a follow-up call next week?",False,
0b6979e4-8c05-49e1-b7a7-94d85a627df5,10,customer,"Yes, that sounds good.",False,
0b6979e4-8c05-49e1-b7a7-94d85a627df5,11,agent,"Alright, I will call you next Wednesday. Thank you for your time, Jessica.",False,
0b6979e4-8c05-49e1-b7a7-94d85a627df5,12,customer,"Thank you, Mark.",False,
0b6979e4-8c05-49e1-b7a7-94d85a627df5,13,agent,Goodbye!,False,
a70624b3-d7ff-4afe-b4b6-a1a5cceccf13,1,agent,"Hello, this is Sarah from XYZ Collections. How are you today?",False,
a70624b3-d7ff-4afe-b4b6-a1a5cceccf13,2,customer,"I'm doing fine, thank you. What’s this about?",False,
a70624b3-d7ff-4afe-b4b6-a1a5cceccf13,3,agent,"I’m calling regarding an outstanding balance on your account. Before we proceed, could you please verify your address for me?",False,
a70624b3-d7ff-4afe-b4b6-a1a5cceccf13,4,customer,"Sure, it's 123 Elm Street.",False,
a70624b3-d7ff-4afe-b4b6-a1a5cceccf13,5,agent,Thank you for that. And can you also confirm your date of birth?,False,
a70624b3-d7ff-4afe-b4b6-a1a5cceccf13,6,customer,"It's April 15, 1990.",False,
a70624b3-d7ff-4afe-b4b6-a1a5cceccf13,7,agent,Thank you for verifying your information. I see that you have a balance of $250. How would you like to handle that today?,False,
a70624b3-d7ff-4afe-b4b6-a1a5cceccf13,8,customer,I can pay $100 now and the rest by the end of the month.,False,
a70624b3-d7ff-4afe-b4b6-a1a5cceccf13,9,agent,That sounds reasonable. I’ll process the $100 payment. Can I confirm your payment method?,False,
a70624b3-d7ff-4afe-b4b6-a1a5cceccf13,10,customer,"Yes, I'll use my credit card.",False,
a70624b3-d7ff-4afe-b4b6-a1a5cceccf13,11,agent,Perfect. Let me get your card details and we'll finalize the transaction.,False,
a70624b3-d7ff-4afe-b4b6-a1a5cceccf13,12,customer,"Okay, I'm ready.",False,
a70624b3-d7ff-4afe-b4b6-a1a5cceccf13,13,agent,Thank you for your cooperation. I appreciate your promptness in addressing this.,False,
a70624b3-d7ff-4afe-b4b6-a1a5cceccf13,14,customer,"No problem, thank you for your help!",False,
3c328f04-6095-406a-aabe-f88bdcf2d125,1,customer,You have reached the voicemail of John Smith. Please leave a message after the beep.,False,
3c328f04-6095-406a-aabe-f88bdcf2d125,2,agent,"Hello John, this is Sarah calling from XYZ Collections regarding your outstanding balance.",False,
3c328f04-6095-406a-aabe-f88bdcf2d125,3,customer,"To ensure a prompt response, please leave your name and number.",False,
3c328f04-6095-406a-aabe-f88bdcf2d125,4,agent,You can reach me directly at 1-800-555-0199. We can help you discuss your payment options.,False,
3c328f04-6095-406a-aabe-f88bdcf2d125,5,customer,"Thank you for calling, I will return your call as soon as possible.",False,
8ae8018c-15b3-46f6-9713-f956505735ec,1,agent,"Hello, this is Mark from XYZ Collections. How are you today?",False,
8ae8018c-15b3-46f6-9713-f956505735ec,2,customer,What the hell do you want? I’m not in the mood for your crap!,True,"crap, hell"
8ae8018c-15b3-46f6-9713-f956505735ec,3,agent,I understand this can be frustrating. I'm here to discuss your account. Can you please verify your date of birth for me?,False,
8ae8018c-15b3-46f6-9713-f956505735ec,4,customer,Why the f*** do I need to tell you anything? Just get to the point!,False,
8ae8018c-15b3-46f6-9713-f956505735ec,5,agent,"I appreciate your patience. I can’t provide any details without verifying your identity first. Just your date of birth, please.",False,
8ae8018c-15b3-46f6-9713-f956505735ec,6,customer,"Fine! It’s July 15, 1985. Now can we move on, or are you gonna waste my time more?",False,
8ae8018c-15b3-46f6-9713-f956505735ec,7,agent,Thank you for that. I have your information now. You currently have an outstanding balance of $500. What is your plan for repayment?,False,
8ae8018c-15b3-46f6-9713-f956505735ec,8,customer,I don’t have that kind of money! You guys are ruthless! Just leave me the f*** alone!,False,
8ae8018c-15b3-46f6-9713-f956505735ec,9,agent,"I understand your concern, but we can work together to find a solution. Would you be willing to set up a payment plan?",False,
8ae8018c-15b3-46f6-9713-f956505735ec,10,customer,A payment plan? You think I have time for your bullsh*t? Just stop calling me!,False,
8ae8018c-15b3-46f6-9713-f956505735ec,11,agent,"I hear you. I'm here to help. If you change your mind, you can always reach out to us. Just remember, we’re available to assist.",False,
8ae8018c-15b3-46f6-9713-f956505735ec,12,customer,"Yeah, whatever. Just don’t call me again, you hear me?",False,
8ae8018c-15b3-46f6-9713-f956505735ec,13,agent,Thank you for your time today. I’ll make sure to note your preference. Have a good day.,False,
584fd5cd-adaa-4315-bf67-ad56d02d135e,1,agent,"Hello, this is Mark from XYZ Collections. How are you today?",False,
584fd5cd-adaa-4315-bf67-ad56d02d135e,2,customer,What the hell do you want? I’m not in the mood for this crap!,True,"crap, hell"
584fd5cd-adaa-4315-bf67-ad56d02d135e,3,agent,I understand you're frustrated. I'm calling about your account. Can you please verify your date of birth?,False,
584fd5cd-adaa-4315-bf67-ad56d02d135e,4,customer,Why the f*** should I tell you anything? Just get lost!,False,
584fd5cd-adaa-4315-bf67-ad56d02d135e,5,agent,I can help you better if I confirm your identity. It’s standard procedure. Please provide your date of birth.,False,
584fd5cd-adaa-4315-bf67-ad56d02d135e,6,customer,What part of 'leave me the hell alone' don’t you get? I’m not giving you anything!,True,hell
584fd5cd-adaa-4315-bf67-ad56d02d135e,7,agent,"I appreciate your honesty. However, I cannot discuss account details until I verify your identity. Could you please provide your address?",False,
584fd5cd-adaa-4315-bf67-ad56d02d135e,8,customer,This is so f****** ridiculous! It’s not like I owe you anything anyway!,False,
584fd5cd-adaa-4315-bf67-ad56d02d135e,9,agent,"I understand your frustration. However, the account is still overdue. We need to verify it to assist you. Can you confirm your address?",False,
584fd5cd-adaa-4315-bf67-ad56d02d135e,10,customer,"You piece of s***, I told you I’m not giving you anything!",False,
584fd5cd-adaa-4315-bf67-ad56d02d135e,11,agent,"I respect your choice, but without verification, I cannot proceed. I’m here to help when you’re ready.",False,
584fd5cd-adaa-4315-bf67-ad56d02d135e,12,customer,"Whatever, just shut the f*** up!",False,
584fd5cd-adaa-4315-bf67-ad56d02d135e,13,agent,Thank you for your time. Feel free to call back if you wish to discuss this further.,False,
584fd5cd-adaa-4315-bf67-ad56d02d135e,14,customer,"Yeah, right. Don’t hold your breath!",False,
627538ce-998a-49ca-9537-4776e8073ea0,1,customer,You have reached the voicemail of Sarah Thompson. Please leave a message after the beep.,False,
627538ce-998a-49ca-9537-4776e8073ea0,2,agent,"Hello, Sarah. This is Tom from Cash Flow Collections. I'm trying to reach you regarding your overdue account.",False,
627538ce-998a-49ca-9537-4776e8073ea0,3,customer,"To leave a message, press one. For more options, press two.",False,
627538ce-998a-49ca-9537-4776e8073ea0,4,agent,Please give me a call back at your earliest convenience. My number is one eight hundred two three four five six seven.,False,
627538ce-998a-49ca-9537-4776e8073ea0,5,customer,Thank you for your call. Have a great day!,False,
af38fcd1-31d5-4128-9dc3-d2b72ecb20c5,1,agent,"Hello, this is Sarah calling from XYZ Collections. Am I speaking with John Smith?",False,
af38fcd1-31d5-4128-9dc3-d2b72ecb20c5,2,customer,"Yes, this is John. What is this about?",False,
af38fcd1-31d5-4128-9dc3-d2b72ecb20c5,3,agent,"I'm reaching out regarding your outstanding balance with Green Finance. Before we proceed, can you please verify your address?",False,
af38fcd1-31d5-4128-9dc3-d2b72ecb20c5,4,customer,"Sure, it's 123 Elm Street, Springfield.",False,
af38fcd1-31d5-4128-9dc3-d2b72ecb20c5,5,agent,Thank you for confirming. Can you also provide your date of birth for verification?,False,
af38fcd1-31d5-4128-9dc3-d2b72ecb20c5,6,customer,"It's July 15, 1985.",False,
af38fcd1-31d5-4128-9dc3-d2b72ecb20c5,7,agent,Great! I appreciate your cooperation. You now have an outstanding balance of $250. How would you like to settle this?,False,
af38fcd1-31d5-4128-9dc3-d2b72ecb20c5,8,customer,I can pay half of it today and the rest next week.,False,
af38fcd1-31d5-4128-9dc3-d2b72ecb20c5,9,agent,That sounds reasonable. Would you like to make the first payment of $125 over the phone or online?,False,
af38fcd1-31d5-4128-9dc3-d2b72ecb20c5,10,customer,I prefer to do it online. Can you send me the link?,False,
af38fcd1-31d5-4128-9dc3-d2b72ecb20c5,11,agent,Absolutely. I will send you an email with the payment link right after this call. Is there anything else I can assist you with?,False,
af38fcd1-31d5-4128-9dc3-d2b72ecb20c5,12,customer,"No, that's all. Thank you for your help!",False,
af38fcd1-31d5-4128-9dc3-d2b72ecb20c5,13,agent,"You're welcome, John! Thank you for your time today. Have a great day!",False,
af38fcd1-31d5-4128-9dc3-d2b72ecb20c5,14,customer,"You too, goodbye!",False,
76e1c00c-bdcf-43c1-aee6-ea7dd7fa85fa,1,agent,"Hello, this is Mark from XYZ Collections. How are you today?",False,
76e1c00c-bdcf-43c1-aee6-ea7dd7fa85fa,2,customer,"I'm doing alright, thanks. What’s this about?",False,
76e1c00c-bdcf-43c1-aee6-ea7dd7fa85fa,3,agent,I’m calling about your outstanding balance with Universal Credit. Can I have your account number to pull up your information?,False,
76e1c00c-bdcf-43c1-aee6-ea7dd7fa85fa,4,customer,I don’t have that right now. Can you tell me what balance you're referring to?,False,
76e1c00c-bdcf-43c1-aee6-ea7dd7fa85fa,5,agent,Your current balance is three hundred fifty dollars. How would you like to proceed with this payment?,False,
76e1c00c-bdcf-43c1-aee6-ea7dd7fa85fa,6,customer,I can’t pay that today. Can we set up a payment plan?,False,
76e1c00c-bdcf-43c1-aee6-ea7dd7fa85fa,7,agent,Sure! We can set up a payment plan. How much can you pay today?,False,
76e1c00c-bdcf-43c1-aee6-ea7dd7fa85fa,8,customer,I can manage fifty dollars today.,False,
76e1c00c-bdcf-43c1-aee6-ea7dd7fa85fa,9,agent,Perfect! I’ll apply that towards your balance. Can I verify your last four digits of your Social Security number?,False,
76e1c00c-bdcf-43c1-aee6-ea7dd7fa85fa,10,customer,"Sure, it's 1234.",False,
76e1c00c-bdcf-43c1-aee6-ea7dd7fa85fa,11,agent,Thank you! We’ve noted your payment. You will still have a remaining balance of three hundred dollars.,False,
76e1c00c-bdcf-43c1-aee6-ea7dd7fa85fa,12,customer,"Okay, but how do I keep track of my payment plan?",False,
76e1c00c-bdcf-43c1-aee6-ea7dd7fa85fa,13,agent,We will send you a confirmation email with all the details and a link to check your account status online.,False,
76e1c00c-bdcf-43c1-aee6-ea7dd7fa85fa,14,customer,"Great, I appreciate your help!",False,
76e1c00c-bdcf-43c1-aee6-ea7dd7fa85fa,15,agent,You're welcome! Thank you for your cooperation. Have a nice day!,False,
65f99be3-1a8a-4f1f-91f0-7f3a4fe4235b,1,agent,"Hello, this is Mark from XYZ Collections. How are you today?",False,
65f99be3-1a8a-4f1f-91f0-7f3a4fe4235b,2,customer,"I'm okay, thanks. What’s this about?",False,
65f99be3-1a8a-4f1f-91f0-7f3a4fe4235b,3,agent,I’m calling regarding your outstanding debt with Global Bank. Can you confirm your name for me?,False,
65f99be3-1a8a-4f1f-91f0-7f3a4fe4235b,4,customer,It's Jordan Smith.,False,
65f99be3-1a8a-4f1f-91f0-7f3a4fe4235b,5,agent,"Thank you, Jordan. Your account shows a balance of $750. How would you like to settle this today?",False,
65f99be3-1a8a-4f1f-91f0-7f3a4fe4235b,6,customer,I need to check my finances before deciding.,False,
65f99be3-1a8a-4f1f-91f0-7f3a4fe4235b,7,agent,"I understand. Just so you know, we can set up a payment plan if that helps.",False,
65f99be3-1a8a-4f1f-91f0-7f3a4fe4235b,8,customer,That could work. Can you send me the details?,False,
65f99be3-1a8a-4f1f-91f0-7f3a4fe4235b,9,agent,"Absolutely, I can send that via email. Can you confirm your email address?",False,
65f99be3-1a8a-4f1f-91f0-7f3a4fe4235b,10,customer,It's jordan.smith@email.com.,False,
65f99be3-1a8a-4f1f-91f0-7f3a4fe4235b,11,agent,Great! I will send the details right away. Is there anything else you need?,False,
65f99be3-1a8a-4f1f-91f0-7f3a4fe4235b,12,customer,"No, that’s all for now. Thanks.",False,
65f99be3-1a8a-4f1f-91f0-7f3a4fe4235b,13,agent,You're welcome! Have a great day.,False,
65f99be3-1a8a-4f1f-91f0-7f3a4fe4235b,14,customer,You too. Bye!,False,
4ff9fec0-757f-4798-9dac-ce77b6cebe7c,1,agent,"Hello, this is Mark calling from XYZ Collections. How are you today?",False,
4ff9fec0-757f-4798-9dac-ce77b6cebe7c,2,customer,"I'm doing okay, thanks. What is this about?",False,
4ff9fec0-757f-4798-9dac-ce77b6cebe7c,3,agent,"I'm reaching out regarding an account you have with Online Credit Services. First, can you please confirm your date of birth for verification?",False,
4ff9fec0-757f-4798-9dac-ce77b6cebe7c,4,customer,"Sure, it's July 15, 1990.",False,
4ff9fec0-757f-4798-9dac-ce77b6cebe7c,5,agent,Thank you for that. Can you also confirm your current address?,False,
4ff9fec0-757f-4798-9dac-ce77b6cebe7c,6,customer,"Yes, it's 123 Maple Street, Anytown, USA.",False,
4ff9fec0-757f-4798-9dac-ce77b6cebe7c,7,agent,"Great, I appreciate your help. I see that you have a balance of $350 on your account. How would you like to proceed with the payment?",False,
4ff9fec0-757f-4798-9dac-ce77b6cebe7c,8,customer,I can make a payment of $200 today and the rest next week.,False,
4ff9fec0-757f-4798-9dac-ce77b6cebe7c,9,agent,That's perfectly fine. I can set up the payment for $200 today. Would you like to use your debit card or bank account?,False,
4ff9fec0-757f-4798-9dac-ce77b6cebe7c,10,customer,I'll use my debit card.,False,
4ff9fec0-757f-4798-9dac-ce77b6cebe7c,11,agent,Thank you. Please provide me with your card number.,False,
4ff9fec0-757f-4798-9dac-ce77b6cebe7c,12,customer,It's 1234-5678-9101-1121.,False,
4ff9fec0-757f-4798-9dac-ce77b6cebe7c,13,agent,Thank you for that. I will process this payment immediately. Is there anything else I can assist you with?,False,
4ff9fec0-757f-4798-9dac-ce77b6cebe7c,14,customer,"No, that will be all. Thank you for your help.",False,
0e2d1981-bd63-4fdd-a4ef-075732cbf26b,1,agent,"Hello, this is Mark from XYZ Collections. How are you today?",False,
0e2d1981-bd63-4fdd-a4ef-075732cbf26b,2,customer,"I'm okay, thanks. What is this about?",False,
0e2d1981-bd63-4fdd-a4ef-075732cbf26b,3,agent,I'm calling regarding an outstanding balance on your account. Can I get your name for verification?,False,
0e2d1981-bd63-4fdd-a4ef-075732cbf26b,4,customer,It's Alex Johnson.,False,
0e2d1981-bd63-4fdd-a4ef-075732cbf26b,5,agent,"Thank you, Alex. You have a balance of $250 due on your account. How would you like to settle this today?",False,
0e2d1981-bd63-4fdd-a4ef-075732cbf26b,6,customer,I didn't realize I had a balance. Can you give me more details?,False,
0e2d1981-bd63-4fdd-a4ef-075732cbf26b,7,agent,"Certainly! The last payment was made in July, and the current balance includes late fees.",False,
0e2d1981-bd63-4fdd-a4ef-075732cbf26b,8,customer,"I see, but I need to check my records before making a payment.",False,
0e2d1981-bd63-4fdd-a4ef-075732cbf26b,9,agent,Of course! Would you like to discuss a payment plan?,False,
0e2d1981-bd63-4fdd-a4ef-075732cbf26b,10,customer,I think that would be best. I need a little more time.,False,
0e2d1981-bd63-4fdd-a4ef-075732cbf26b,11,agent,I understand. We can set up a plan for you. When do you think you could make the first payment?,False,
0e2d1981-bd63-4fdd-a4ef-075732cbf26b,12,customer,Maybe next week. I'll check my schedule.,False,
0e2d1981-bd63-4fdd-a4ef-075732cbf26b,13,agent,That sounds good. Please don't hesitate to call us back if you have any questions.,False,
0e2d1981-bd63-4fdd-a4ef-075732cbf26b,14,customer,"Thanks for your help, Mark. I appreciate it.",False,
0e2d1981-bd63-4fdd-a4ef-075732cbf26b,15,agent,"You're welcome, Alex! Have a great day!",False,
e0a8f9d2-92d6-4093-bb97-82182c6e850f,1,agent,"Hello, this is Mike from XYZ Collections. I'm calling about your overdue account. Can you confirm your date of birth for verification?",False,
e0a8f9d2-92d6-4093-bb97-82182c6e850f,2,customer,"Sure, my date of birth is April 12, 1985.",False,
e0a8f9d2-92d6-4093-bb97-82182c6e850f,3,agent,"Great, thanks. Now, can you also confirm your current address?",False,
e0a8f9d2-92d6-4093-bb97-82182c6e850f,4,customer,"Yes, I live at 123 Main Street, Springfield.",False,
e0a8f9d2-92d6-4093-bb97-82182c6e850f,5,agent,"Alright, you have a balance of $1,200. It's time to settle this shit. How are you going to pay today?",True,shit
e0a8f9d2-92d6-4093-bb97-82182c6e850f,6,customer,I prefer to discuss my payment options calmly first.,False,
e0a8f9d2-92d6-4093-bb97-82182c6e850f,7,agent,"Calmly? Seriously? You owe us money, and you're talking about 'calmly'? Just get your shit together and pay up!",True,shit
e0a8f9d2-92d6-4093-bb97-82182c6e850f,8,customer,"I understand that, but I need to know all my options before I commit to anything.",False,
e0a8f9d2-92d6-4093-bb97-82182c6e850f,9,agent,"Options? You think you can just pick and choose? We are not running a charity here, you know!",False,
e0a8f9d2-92d6-4093-bb97-82182c6e850f,10,customer,I am just trying to understand my responsibilities and plan accordingly.,False,
e0a8f9d2-92d6-4093-bb97-82182c6e850f,11,agent,Responsibilities? How about you just quit making excuses? Pay what you owe!,False,
e0a8f9d2-92d6-4093-bb97-82182c6e850f,12,customer,"I will make a payment soon, but I need to make sure it fits within my budget.",False,
e0a8f9d2-92d6-4093-bb97-82182c6e850f,13,agent,"You're wasting my time. Just give me a damn date when you'll pay, or I’ll escalate this further!",True,damn
e0a8f9d2-92d6-4093-bb97-82182c6e850f,14,customer,"I appreciate your urgency, but I need some time to sort things out and I will get back to you.",False,
e0a8f9d2-92d6-4093-bb97-82182c6e850f,15,agent,"You better not keep dragging this out, or I'll make your life a living hell!",True,hell
179f40ff-742d-4703-94c4-430f631e3f83,1,agent,"Hello, this is Mark from XYZ Collections. How are you today?",False,
179f40ff-742d-4703-94c4-430f631e3f83,2,customer,"I'm doing alright, thanks. What's this about?",False,
179f40ff-742d-4703-94c4-430f631e3f83,3,agent,"I'm calling regarding your outstanding balance with City Credit. Before we discuss any details, can you please confirm your date of birth?",False,
179f40ff-742d-4703-94c4-430f631e3f83,4,customer,"Sure, it's January 15, 1990.",False,
179f40ff-742d-4703-94c4-430f631e3f83,5,agent,Thank you. Can you also confirm your current address for verification?,False,
179f40ff-742d-4703-94c4-430f631e3f83,6,customer,"Yes, I live at 123 Maple Street, Springfield.",False,
179f40ff-742d-4703-94c4-430f631e3f83,7,agent,"I appreciate that. Now, I can confirm you have an outstanding balance of $250. How would you like to proceed with the payment?",False,
179f40ff-742d-4703-94c4-430f631e3f83,8,customer,I can pay half of that amount today.,False,
179f40ff-742d-4703-94c4-430f631e3f83,9,agent,That's great. So you'll be paying $125 today? How would you like to make that payment?,False,
179f40ff-742d-4703-94c4-430f631e3f83,10,customer,I'll do it via credit card over the phone.,False,
179f40ff-742d-4703-94c4-430f631e3f83,11,agent,"Perfect! Please provide your card details, and I'll process the payment right away.",False,
179f40ff-742d-4703-94c4-430f631e3f83,12,customer,My card number is 4111 1234 5678 9010.,False,
179f40ff-742d-4703-94c4-430f631e3f83,13,agent,Thank you. I am processing that now. One moment please.,False,
179f40ff-742d-4703-94c4-430f631e3f83,14,customer,"Okay, I'm waiting.",False,
179f40ff-742d-4703-94c4-430f631e3f83,15,agent,Your payment has been successfully processed. Thank you for your cooperation today!,False,
229439eb-043f-4267-b327-88838b642233,1,agent,"Hello, this is Karen from XYZ Collections. How are you today?",False,
229439eb-043f-4267-b327-88838b642233,2,customer,"Hi Karen, I'm doing well, thank you. What’s this about?",False,
229439eb-043f-4267-b327-88838b642233,3,agent,"I’m reaching out regarding your account with City Finance. To ensure your privacy, could you please confirm your date of birth?",False,
229439eb-043f-4267-b327-88838b642233,4,customer,"Sure, it's July 15th, 1985.",False,
229439eb-043f-4267-b327-88838b642233,5,agent,Thank you for that information. Can you also verify your current address?,False,
229439eb-043f-4267-b327-88838b642233,6,customer,"Yes, it's 123 Elm Street, Springfield.",False,
229439eb-043f-4267-b327-88838b642233,7,agent,"Great, thank you for confirming your identity. You currently have an outstanding balance of $250. How would you like to proceed with the payment?",False,
229439eb-043f-4267-b327-88838b642233,8,customer,I can pay $100 today and the rest next week.,False,
229439eb-043f-4267-b327-88838b642233,9,agent,That sounds good. Can I take your payment method for the $100?,False,
229439eb-043f-4267-b327-88838b642233,10,customer,I’ll use my credit card.,False,
229439eb-043f-4267-b327-88838b642233,11,agent,Perfect! Please provide your card number.,False,
229439eb-043f-4267-b327-88838b642233,12,customer,It's 4111 1111 1111 1111.,False,
229439eb-043f-4267-b327-88838b642233,13,agent,Thank you! Your payment has been processed. You will receive a confirmation via email.,False,
229439eb-043f-4267-b327-88838b642233,14,customer,"Thank you, Karen. Have a great day!",False,
229439eb-043f-4267-b327-88838b642233,15,agent,You're welcome! Take care!,False,
a9eab46a-0595-4f5a-9888-b3ae63b06f74,1,customer,You have reached the voicemail of Jamie Smith. Please leave your name and number after the beep.,False,
a9eab46a-0595-4f5a-9888-b3ae63b06f74,2,agent,"Hello, Jamie. This is Michael from Capital Collections.",False,
a9eab46a-0595-4f5a-9888-b3ae63b06f74,3,agent,I’m calling about your overdue balance. Please contact us as soon as possible at one eight hundred two four one five six seven eight.,False,
a9eab46a-0595-4f5a-9888-b3ae63b06f74,4,customer,Thank you for your call. I’ll be sure to return it as soon as I can.,False,
a9eab46a-0595-4f5a-9888-b3ae63b06f74,5,agent,We appreciate your prompt attention to this matter. Have a great day!,False,
ebaf8b12-5d22-492c-b392-1b92872f7b69,1,agent,"Hello, this is Sarah from XYZ Collections. How are you today?",False,
ebaf8b12-5d22-492c-b392-1b92872f7b69,2,customer,"I'm fine, thanks. What's this about?",False,
ebaf8b12-5d22-492c-b392-1b92872f7b69,3,agent,"I’m calling about your outstanding balance with LMN Credit. Before we proceed, can you please verify your date of birth?",False,
ebaf8b12-5d22-492c-b392-1b92872f7b69,4,customer,"Sure, it’s May 12, 1990.",False,
ebaf8b12-5d22-492c-b392-1b92872f7b69,5,agent,Thank you. Could you also confirm your current address for verification?,False,
ebaf8b12-5d22-492c-b392-1b92872f7b69,6,customer,"Yes, it’s 123 Elm Street, Springfield.",False,
ebaf8b12-5d22-492c-b392-1b92872f7b69,7,agent,"Great, I can now discuss your account. You currently have a balance of $250. How would you prefer to settle this?",False,
